{
  "$schema": "https://json-schema.org/draft/2020-12/schema",
  "$id": "https://schemas.jinn.network/jinn-manifest-v1.json",
  "title": "Jinn external Harness manifest",
  "type": "object",
  "additionalProperties": false,
  "required": [
    "schemaVersion",
    "name",
    "version",
    "supportedSolverTypes",
    "entry",
    "package",
    "capabilities",
    "signature"
  ],
  "properties": {
    "schemaVersion": { "const": "1.0.0" },
    "name": {
      "type": "string",
      "pattern": "^(@[a-z0-9-]+/)?[a-z0-9][a-z0-9-]*$"
    },
    "version": {
      "type": "string",
      "pattern": "^[0-9]+\\.[0-9]+\\.[0-9]+(-[a-z0-9.-]+)?$"
    },
    "description": { "type": "string", "maxLength": 500 },
    "supportedSolverTypes": {
      "type": "array",
      "minItems": 1,
      "items": {
        "type": "string",
        "pattern": "^[a-z][a-z0-9-]*\\.v[0-9]+(>=[0-9]+\\.[0-9]+\\.[0-9]+)?$"
      }
    },
    "entry": {
      "type": "string",
      "description": "Package-relative module path. MUST start with `./` and MUST NOT contain `..` segments (defence against directory traversal at install time). The loader additionally enforces containment at runtime — see `client/src/harnesses/external-impls/loader.ts`.",
      "pattern": "^\\./(?!(?:.*/)?\\.\\.(?:/|$))[A-Za-z0-9_./-]+$"
    },
    "package": {
      "type": "object",
      "required": ["cid", "hash"],
      "additionalProperties": false,
      "properties": {
        "cid": { "type": "string", "pattern": "^baf[a-z0-9]+$" },
        "hash": {
          "type": "string",
          "pattern": "^sha256:[0-9a-f]{64}$"
        }
      }
    },
    "capabilities": {
      "type": "object",
      "additionalProperties": false,
      "properties": {
        "signer": {
          "type": "object",
          "required": ["selectors"],
          "additionalProperties": false,
          "properties": {
            "selectors": {
              "type": "array",
              "items": {
                "type": "object",
                "required": ["chainId", "to", "selector"],
                "additionalProperties": false,
                "properties": {
                  "chainId": { "type": "integer", "minimum": 1 },
                  "to": {
                    "type": "string",
                    "pattern": "^0x[a-fA-F0-9]{40}$"
                  },
                  "selector": {
                    "type": "string",
                    "pattern": "^0x[a-f0-9]{8}$"
                  },
                  "description": { "type": "string", "maxLength": 200 }
                }
              }
            },
            "typedDataDomains": {
              "type": "array",
              "description": "Allow-list for `signTypedData` EIP-712 domains. The daemon's scoped signer refuses any `signTypedData` call whose domain does not match an entry here. `chainId` must match exactly; `verifyingContract` / `name` / `version` are matched only if specified in the entry. Empty or omitted array = default-deny (every `signTypedData` call throws).",
              "items": {
                "type": "object",
                "required": ["chainId"],
                "additionalProperties": false,
                "properties": {
                  "chainId": { "type": "integer", "minimum": 1 },
                  "name": { "type": "string", "maxLength": 100 },
                  "version": { "type": "string", "maxLength": 50 },
                  "verifyingContract": {
                    "type": "string",
                    "pattern": "^0x[a-fA-F0-9]{40}$"
                  }
                }
              }
            }
          }
        },
        "rpc": {
          "type": "array",
          "items": {
            "type": "object",
            "required": ["chainId", "methods"],
            "additionalProperties": false,
            "properties": {
              "chainId": { "type": "integer", "minimum": 1 },
              "methods": {
                "type": "array",
                "items": {
                  "enum": [
                    "eth_call",
                    "eth_getBlockByNumber",
                    "eth_getLogs",
                    "eth_getTransactionReceipt",
                    "eth_chainId",
                    "eth_blockNumber",
                    "eth_getBalance",
                    "eth_getCode"
                  ]
                }
              },
              "rateLimit": {
                "type": "object",
                "required": ["perSec"],
                "additionalProperties": false,
                "properties": {
                  "perSec": { "type": "integer", "minimum": 1 }
                }
              }
            }
          }
        },
        "secrets": {
          "type": "array",
          "items": {
            "type": "object",
            "required": ["name", "description", "required"],
            "additionalProperties": false,
            "properties": {
              "name": { "type": "string" },
              "description": { "type": "string" },
              "required": { "type": "boolean" }
            }
          }
        }
      }
    },
    "signature": {
      "type": "object",
      "required": ["alg", "publicKey", "sig"],
      "additionalProperties": false,
      "properties": {
        "alg": { "const": "ed25519" },
        "publicKey": { "type": "string" },
        "sig": { "type": "string" }
      }
    },
    "author": {
      "type": "object",
      "additionalProperties": false,
      "properties": {
        "name": { "type": "string" },
        "url": { "type": "string", "format": "uri" }
      }
    },
    "license": { "type": "string" }
  }
}
